guid,expression,meaning,kana,notes,tags
LX8OTJiIKm,山下先生は日本人で、五十歳ぐらいです。,Professor Yamashita is a Japanese and he is about fifty years old.,やましたせんせいはにっぽんじんで、さいぐらいです。,,"Japanese::Sentences, lesson-7"
Q/b@o]|.K,デパートにかばんを買いに行きました。,I went to a department store to buy a bag.,デパートにかばんをかいにいきました。,,"Japanese::Sentences, lesson-7"
CgoONnls-a,メアリーさんは日本に日本語を勉強しに来ました。,Mary has come to Japan to study Japanese.,メアリーさんはにっぽんににほんごをべんきょうしにきました。,,"Japanese::Sentences, lesson-7"
u)!Q45%L#D,私のクラスに（は）スウェーデン人の学生が一人います。,There is one Swedish student in our class.,わたしのクラスに（は）スウェーデン じんのがくせいが一にんいます。,,"Japanese::Sentences, lesson-7"
u+(&ZAmY/;,（私は）たけしさんはメアリーさんが好きだと思います。,I think Takeshi likes Mary.,（ 私は）たけしさんはメアリーさんがすきだとおもいます。,,"Japanese::Sentences, lesson-8"
v>[u.vl^fr,（私は）メアリーさんはたけしさんが好きじゃないと思います。,I don't think Mary likes Takeshi. (= I think Mary doesn't like Takeshi.),（ わたしは）メアリーさんはたけしさんが すきじゃないとおもいます。,To say you don't think something is the case it is more common to use ～ないと思います。,"Japanese::Sentences, lesson-8"
uC@/h1|&4Z,ここで写真を撮らないでください。,Please don't take pictures here.,ここでしゃしんをとらないでください。,,"Japanese::Sentences, lesson-8"
fy5A{zzPCI,（私は）日本語を勉強するのが好きです。,I like studying the Japanese language.,（ わたしは）にほんごをべんきょうするのが すきです。,,"Japanese::Sentences, lesson-8"
cdiOnxA5X-,（私は）部屋を掃除するのが嫌いです。,I don't like cleaning my room.,（ わたしは）へやをそうじするのがきらいです。,,"Japanese::Sentences, lesson-8"
d)r32N>E{t,ロバートさんは料理を作るのが上手です。,Robert is good at cooking meals.,ロバートさんはりょうりをつくるのがじょうずです。,,"Japanese::Sentences, lesson-8"
cs*3iQ1wP+,たけしさんは英語を話すのが下手です。,Takeshi is not a good speaker of English.,たけしさんは えいごを はなすのがへたです。,,"Japanese::Sentences, lesson-8"
c/3h{t92@4,私は日本語を話すのがとくいです。,I am good at / comfortable with speaking Japanese.,わたしは にほんごを はなすのがとくいです。,"To describe one's skill or lack thereof, we often use ～がとくいです、～がにがてです。","Japanese::Sentences, lesson-8"
P5cqBWV8yH,私は日本語を話すのがにがてです。,I am bad at / uncomfortable with speaking Japanese.,わたしは にほんごを はなすのがにがてです。,"To describe one's skill or lack thereof, we often use ～がとくいです、～がにがてです。","Japanese::Sentences, lesson-8"
y^zp/&ILY?,ロバートさんが沖縄に行きました。,Robert went to Okinawa.,ロバートさんがおきなわにいきました。,Used when answering a question / introducing a topic.,"Japanese::Sentences, lesson-8"
UCu|&s?W.,誰が沖縄に行きましたか。,Who went to Okinawa?,だれがおきなわに いきましたか。,Not: 誰は沖縄に行きましたか。,"Japanese::Sentences, lesson-8"
K1qs&Wfq-4,どのクラスが面白いですか。,Which class is (the most) interesting?,どのクラスがおもしろいですか。,,"Japanese::Sentences, lesson-8"
xK1V@dH`Eg,日本語のクラスが面白いです。,Japanese class is (the most) interesting.,にほんごのクラスがおもしろいです。,,"Japanese::Sentences, lesson-8"
rr(bK/vk_U,（このクラス）誰がめがねをかけていますか。,Who wears glasses (in this class)?,（このクラス）だれがめがねをかけていますか。,,"Japanese::Sentences, lesson-8"
LnihdUPjh],山下先生がめがねをかけています。,Professor Yamashita wears classes.,やましたせんせいがめがねをかけています。,,"Japanese::Sentences, lesson-8"
O=%m|BAl43,猫が何か持って来ました。,The cat has brought something.,ねこが なにかもってきました。,,"Japanese::Sentences, lesson-8"
v#uSgVs.jB,猫は何か食べましたか。,Did the cat eat anything?,ねこは なにかたべましたか。,,"Japanese::Sentences, lesson-8"
B57);>h%q8,いいえ、猫は何も食べませんでした。,"No, the cat did not eat anything.",いいえ、 ねこは なにもたべませんでした。,,"Japanese::Sentences, lesson-8"
k3%/uOW-[1,私はまだ宿題をしていません。,I have not done the homework yet.,わたしはまだ 宿題[しゅくだい]をしていません。,,"Japanese::Sentences, lesson-9"
dqyzCnp;1-,スーさんはまだ起きていません。,Sue has not woken up yet.,スーさんはまだ おきていません。,,"Japanese::Sentences, lesson-9"
Fuu1.P(Y7S,私はまだ昼ご飯を食べていません。,I haven't eaten lunch yet.,わたしはまだ ひるごはんを たべていません。,,"Japanese::Sentences, lesson-9"
C5n;pEdH}X,晩御飯、食べた？,Have dinner yet?,晩[ばん] ごはん、 たべた？,Casual Conversation,"Japanese::Sentences, lesson-9"
M|{brG$Uw`,スーさんは、高校の時めがねをかけていたと言っていました。,Sue said that she wore glasses in high school.,スーさんは、 高校[こうこう]の 時[とき]めがねをかけていたと 言[い]っていました。,"Quoted Speech. Must maintain tense of quote, that is if Sue's quote was present tense いる should be used.","Japanese::Sentences, lesson-9"
s5w=3.=.>g,（私は）トムさんがやったと思います。,I think Tom did it.,（ わたしは）トムさんがやったと 思[おも]います。,Godan&nbsp;update hint,"Japanese::Sentences, lesson-9"
F7g:g(=m~D,あそこで本を読んでいる学生はみちこさんです。,The student who is reading a book over there is Michiko.,あそこで 本[ほん]を 読[よ]んでいる 学生[がくせい]はみちこさんです。,,"Japanese::Sentences, lesson-9"
|t^[v=dCl,髪が長い人,A person who has long hair.,髪[かみ]が 長[なが]い ひと,,"Japanese::Sentences, lesson-9"
l-&TlX-*^n,めがねをかけている人,A person who wears glasses.,めがねをかけている ひと,,"Japanese::Sentences, lesson-9"
P~:F/P#Pa<,猫が好きな人,A person who likes cats,猫[ねこ]が すきな ひと,,"Japanese::Sentences, lesson-9"
jr1pWaeL8^,あそこで写真を撮っている人（は誰ですか。）,Who is that person taking pictures over there?,あそこで 写真[しゃしん]を 撮[と]っている ひと（は 誰[だれ]ですか。）,,"Japanese::Sentences, lesson-9"
kEy<yJ]&Z>,たばこを吸わない人（が好きです。）,(I like) people who do not smoke.,たばこを 吸[す]わない ひと（が すきです。）,,"Japanese::Sentences, lesson-9"
M.TY~9(`b_,明日試験があるから、私は今晩勉強します。,"I will study this evening, because we will have an exam tomorrow. (Lit: We will have an exam tomorrow, therefore, I will study this evening.)",明日[あした] 試験[しけん]があるから、 わたしは 今晩[こんばん] 勉強[べんきょう]します。,"Long form before から is more polite, and is frequently used in requests and suggestion sentences.","Japanese::Sentences, lesson-9"
c8k+|]5r81,寒かったから、出掛けませんでした。,"We didn't go out, because it was cold. (Lit: It was cold, therefore, we didn't go out.)",寒[さむ]かったから、 出掛[でか]けませんでした。,"Long form before から is more polite, and is frequently used in requests and suggestion sentences.","Japanese::Sentences, lesson-9"
