guid,expression,meaning,kana,notes,tags
jKf#{M)^;u,12時半です。,(It) is half past twelve.,じゅうにじはんです,,"Japanese::Sentences, lesson-1"
LA^K?S?CF5,学生です。,(I) am a student.,がくせいです,,"Japanese::Sentences, lesson-1"
bUeC~s+iC6,日本語です。,(My major) is the Japanese language.,,,"Japanese::Sentences, lesson-1"
Fd=F8}p~O`,私はスー・キムです。,I am Sue Kim.,,,"Japanese::Sentences, lesson-1"
i7?iW2Ud#i,山下さんは先生です。,Mr. Yamashita is a teacher.,やましたさんはせんせいです,,"Japanese::Sentences, lesson-1"
l_+#v%-TNj,メアリーさんはアメリカ人です。,Mary is an American,メアリーさんはアメリカじんです,,"Japanese::Sentences, lesson-1"
f~vx<VSv?:,専攻は何ですか。,What is your major?,せんこうはなにですか,"Use なん, with counters or です. Use なに before particles and なんじん (person of what nationality).","Japanese::Sentences, lesson-1"
g%O@}Xe~LX,今何時ですか。,What time is it now?,いまなんじですか,"Use なん, with counters or です. Use なに before particles and なんじん (person of what nationality).","Japanese::Sentences, lesson-1"
l9&5Gdg35a,（今）九時です。,It is nine o'clock.,（いま）きゅうじです,,"Japanese::Sentences, lesson-1"
lmKU}bYi]z,メアリーさんは何歳ですか。,"How old are you, Mary?",メアリーさんはなんさいですか,"Use なん, with counters or です. Use なに before particles and なんじん (person of what nationality).","Japanese::Sentences, lesson-1"
iK)@:~d~>R,十九歳です。,I am nineteen years old.,じゅうきゅうさいです,,"Japanese::Sentences, lesson-1"
j=zH<iT0IH,電話番号は何ですか。,What is your telephone number?,でんわばんごうはなにですか。,"Use なん, with counters or です. Use なに before particles and なんじん (person of what nationality).","Japanese::Sentences, lesson-1"
b[`|_4V0m%,１８６の７３４３です。,It is 186-7343.,,,"Japanese::Sentences, lesson-1"
N-`~y_HnIL,武さんのお母さんは高校の先生です。,Takeshi's mother is a high school teacher.,たけさんのおかあさんはこうこうのせんせいです。,,"Japanese::Sentences, lesson-1"
A@bVg>A7?Y,これはいくらですか。,How much is this?,,,"Japanese::Sentences, lesson-2"
v+FWYVnOf^,それは三千円です。,"That is 3,000 yen.",,,"Japanese::Sentences, lesson-2"
As1fb{sflT,あれは私のぺんです。,That is my pen.,,,"Japanese::Sentences, lesson-2"
jK([m|{%Wq,これは私のぺんです。,This is my pen.,,,"Japanese::Sentences, lesson-2"
Q|Wgp;.Ova,それは私のぺんです。,That is my pen.,,,"Japanese::Sentences, lesson-2"
xkvR{77%m,どれですか。,Which one is it (that you are talking about)?,,,"Japanese::Sentences, lesson-2"
x@!J0f*aw|,どれがあなたのぺんですか。,Which one is your pen?,,どれ and 何 cannot be followed by particle は,"Japanese::Sentences, lesson-2"
"y^7~,MLV4B",この時計はいくらですか。,How much is this watch?,このとけいはいくらですか。,,"Japanese::Sentences, lesson-2"
KWmm/zJE3S,その時計は三千円です。,"That watch is 3,000 yen.",そのとけいは三せん円です。,,"Japanese::Sentences, lesson-2"
k&Snc=p85z,あの時計は三千五百円です。,"That watch over there is 3,500 yen.",あのとけいは三千五百円です。,,"Japanese::Sentences, lesson-2"
F_i=B.};9@,どの時計が三千五百円ですか。,"Which watch is 3,500 yen?",どのとけいが三千五百円ですか。,question words like どの cannot be followed by particle は,"Japanese::Sentences, lesson-2"
caXXw>S57k,すみません。郵便局はどこですか。,Excuse me. Where is the post office?,すみません。 ゆうびんきょくはどこですか。,,"Japanese::Sentences, lesson-2"
n$I3RB8v)`,これはだれのかばんですか。,Whose bag is this?,,,"Japanese::Sentences, lesson-2"
"z,}l0E(?1a",それはスーさんのかばんです。,That is Sue's bag.,,,"Japanese::Sentences, lesson-2"
K3%pqp$sT*,武さんは日本人です。,Takeshi is a Japanese person.,たけしさんは日本人です。,,"Japanese::Sentences, lesson-2"
hN0?J3@V~H,美智子さんも日本人です。,"Michiko is Japanese, too.",みちこさんも日本人です。,,"Japanese::Sentences, lesson-2"
vS96U-eFz:,山田さんは学生じゃないです。,Mr. Yamada is not a student.,やまださんはがくせいじゃないです。,,"Japanese::Sentences, lesson-2"
e%:pQJ8|M{,山田さんは学生じゃありません。,Mr. Yamada is not a student.,やまださんはがくせいじゃありません。,,"Japanese::Sentences, lesson-2"
K]qa=[1{%R,山田さんは学生じゃないです。,Mr. Yamada is not a student.,やまださんはがくせいじゃないです。,,"Japanese::Sentences, lesson-2"
F|CryHiZ/0,これは肉じゃないですね。,"This is not meat, is it?",これはにくじゃないですね。,,"Japanese::Sentences, lesson-2"
HK0k&o+7ge,じゃあ、その時計を下さい。,"Then, I'll take that watch.",じゃあ、そのとけいをください。,,"Japanese::Sentences, lesson-2"
w2nZd-/]?>,じゃあ、これをお願いします。,"Then, I'll have this.",じゃあ、これをおねがいします。,,"Japanese::Sentences, lesson-2"
GEu_X1TFN~,私はよくテレビを見ます。,I often watch TV.,わたしはよくテレビをみます。,,"Japanese::Sentences, lesson-3"
FcCMWwMaE>,メアリーさんは時々朝ご飯を食べません。,Mary sometimes doesn't eat breakfast.,メアリーさんはときどきあさごはんをたべません。,,"Japanese::Sentences, lesson-3"
GILbM]i#oV,私は明日京都に行きます。,I will go to Kyoto tomorrow.,わたしはあしたきょうとにいきます。,,"Japanese::Sentences, lesson-3"
sezEuG{B`6,スーさんは今日家に帰りません。,Sue will not return home today.,スーさんはきょういえにかえりません。,Neg,"Japanese::Sentences, lesson-3"
"FZB^z,$*e~",コーヒーを飲みます。,I drink coffee.,コーヒーをのみます。,,"Japanese::Sentences, lesson-3"
JV$w!2eF}F,音楽を聞きます。,I listen to music.,おんがくをききます。,,"Japanese::Sentences, lesson-3"
b[Ap[[MT*2,テレビを見ます。,I watch TV.,テレビをみます。,,"Japanese::Sentences, lesson-3"
HW)2fn2tr_,図書館で本を読みます。,I will read books in the library.,としょかんで 本ほんをよみます。,,"Japanese::Sentences, lesson-3"
xiPm}qa/@G,家でテレビを見ます。,I will watch TV at home.,いえでテレビをみます。,,"Japanese::Sentences, lesson-3"
%uGs-yk~U,私は今日学校に行きません。,I will not go to school today.,わたしはきょうがっこうにいきません。,に would work here too,"Japanese::Sentences, lesson-3"
q+*Q(3XM5,私は家に帰ります。,I will return home.,わたしはいえにかえります。,へ would work here too,"Japanese::Sentences, lesson-3"
GTztuv($h8,日曜日に京都に行きます。,I will go to Kyoto on Sunday.,にちようびにきょうとにいきます。,,"Japanese::Sentences, lesson-3"
"c@&!K:RR,`",11時に寝ます。,I will go to bed at eleven.,十一じにねます。,,"Japanese::Sentences, lesson-3"
D321r+BJ?$,四時ごろに寝ます。,I go to bed at about four o'clock.,よんじごろにねます。,,"Japanese::Sentences, lesson-3"
IU$Vn|@f>_,火曜日に行きます。,I will go on Tuesday.,かようびにいきます。,,"Japanese::Sentences, lesson-3"
hm!~0(|t*I,十時四十五分に起きます。,I get up at 10:45.,十じ四十五ぷんにおきます。,,"Japanese::Sentences, lesson-3"
DiZbnv/yRb,9月に帰ります。,I will go back in September.,くがつにかえります。,,"Japanese::Sentences, lesson-3"
tPGCAOj?r-,明日来ます。,I will come tomorrow.,あしたきます。,,"Japanese::Sentences, lesson-3"
x&m7~FogR),毎晩テレビを見ます。,I watch TV every evening.,まいばんテレビをみます。,,"Japanese::Sentences, lesson-3"
p#Uu7:A=Bi,朝に新聞を読みます。,I read the newspaper in the morning.,あさにしんぶんをよみます。,,"Japanese::Sentences, lesson-3"
Or<o{xfB5b,週末に何をしますか。,What will you do on weekends?,しゅうまつになにをしますか。,,"Japanese::Sentences, lesson-3"
E%Gel?SGB^,昼ご飯を食べませんか。,What do you say to having lunch with me?,ひるごはんをたべませんか。,,"Japanese::Sentences, lesson-3"
dE}wJ*g+|e,いいですね。,Sounds great.,いいですね。,,"Japanese::Sentences, lesson-3"
CNe[GLMfmd,テニスをしませんか。,Will you play tennis with me?,テニスをしませんか。,,"Japanese::Sentences, lesson-3"
G|%Ns.!P<;,ううん、ちょうと。,"Um, it's slightly (inconvenient for me at this moment),",ううん、ちょうと。,,"Japanese::Sentences, lesson-3"
Pc(@eR7p_a,私は時々喫茶店に行きます。,I sometimes go to a coffee shop.,わたしはときどききっさてんにいきます。,,"Japanese::Sentences, lesson-3"
OM]7eBHb8Q,私は残念テレビを見ません。,I do not watch TV at all.,わたしはざんねんテレビをみません。,,"Japanese::Sentences, lesson-3"
zH@1Rm.~6{,武さんはあまり勉強しません。,Takeshi does not study much.,たけさんはあまりべんきょうしません。,,"Japanese::Sentences, lesson-3"
B{t_Pw?&pJ,メアリーさん、週末はたいてい、何をしますか。,"Mary, what do you usually do on the weekend?",メアリーさん、しゅうまつはたいてい、なにをしますか。,,"Japanese::Sentences, lesson-3"
"EzJ#,QF!dt",今日は京都に行きます。,I'm going to Kyoto today.,きょうは 京都きょうとにいきます。,,"Japanese::Sentences, lesson-3"
m==|&k^4Vd,晩ご飯は？,How about dinner?,ばんごはんは？,,"Japanese::Sentences, lesson-3"
M3HamGfGJW,ちょっと下さい。,Please give me a little.,ちょっとください。,,"Japanese::Sentences, lesson-3"
dEFpu<gC*=,ちょっと待ってください。,Please wait a moment.,ちょっとまってください。,,"Japanese::Sentences, lesson-3"
gfU9-$8Fct,A:　土曜日に映画をみませんか。,Saturday is not convenient,どようびにえいがをみませんか。,,"Japanese::Sentences, lesson-3"
HF-A&aYa2(,あそこにマクルドナルドがあります。,There's a McDonald's over there.,,,"Japanese::Sentences, lesson-4"
K?iQ.`KTH(,テレビがありません。,I don't have a TV.,,,"Japanese::Sentences, lesson-4"
QV@!<@b}0j,テレビじゃありません。,It isn't a TV.,,,"Japanese::Sentences, lesson-4"
D<wiSfNB:O,時間がありますか。,Do you have time?,じかんがありますか。,,"Japanese::Sentences, lesson-4"
p>QDZ8cWU2,火曜日にテストがあります。,There will be an exam on Tuesday.,かようびにテストがあります。,,"Japanese::Sentences, lesson-4"
CgU<k;l%~|,明日は日本語のクラスがありません。,There will be no Japanese class tomorrow.,あしたはにほんごのクラスがありません。,,"Japanese::Sentences, lesson-4"
"nw,><IxxeJ",明日京都でお祭りがあります。,There will be a festival in Kyoto,あしたきょうとでおまつりがあります。,,"Japanese::Sentences, lesson-4"
I-{_|`6jy2,あそこに留学生がいます。,There's an international student over there.,あそこにりゅうがくせいがいます。,,"Japanese::Sentences, lesson-4"
Lt}90?Fy=a,日本人の友達がいます。,I have a Japanese friend.,にっぽんじんのともだちがいます。,,"Japanese::Sentences, lesson-4"
C?wNiuC!]+,体育館はどこですか。,Where's the gym?,たいいくかんはどこですか。,,"Japanese::Sentences, lesson-4"
h%l!v#M${/,（銀行は）あのデパートの前です。,(The bank) is in front of that department store.,（ぎんこうは）あのデパートのまえです。,,"Japanese::Sentences, lesson-4"
yDIH3|H9]r,銀行は図書館の隣です。,The bank is next to the library.,ぎんこうはとしょかんのとなりです。,,"Japanese::Sentences, lesson-4"
xHH6e>Zo/V,傘はテーブルのそばです。,The umbrella is by the table.,かさはテーブルのそばです。,,"Japanese::Sentences, lesson-4"
FX2qU.=sQ!,レストランはデパートと病院の間です。,The restaurant is between the department store and the hospital.,レストランはデパートとびょういんのまです。,,"Japanese::Sentences, lesson-4"
bN|%*1}By$,私はモスバーガーの向いでメアリーさんを待ちました。,I waited for Mary across the street from the Mos Burger place.,わたしはモスバーガーのむかいでメアリーさんをまちました。,,"Japanese::Sentences, lesson-4"
O)ZQ+{pg{z,山下先生は桜大学の学生でした。,Mr. Yamashita was a student at Sakura University.,やましたせんせいはさくらだいがくのがくせいでした。,,"Japanese::Sentences, lesson-4"
ptsV^.zU]v,あれは日本の映画じゃなかったです。,That was not a Japanese movie.,あれはにっぽんのえいがじゃなかったです。,,"Japanese::Sentences, lesson-4"
EW=XIN9.{O,メアリーさんは九時ごろ家に帰りました。,Mary returned home at about nine.,メアリーさんは九じごろかにかえりました。,,"Japanese::Sentences, lesson-4"
kKnQ9nQQu:,私は昨日日本語を勉強しませんでした。,I did not study Japanese yesterday.,わたしはきのうにほんごをべんきょうしませんでした。,,"Japanese::Sentences, lesson-4"
ij!@3V4N(),私は昨日京都に行きました。,I went to Kyoto yesterday.,わたしはきのうきょうとにいきました。,,"Japanese::Sentences, lesson-4"
jia<C[Vxyr,山下先生も昨日京都に行きました。,"Professor Yamashita went to Kyoto yesterday, too.",やましたせんせいもきのうきょうとにいきました。,,"Japanese::Sentences, lesson-4"
s4r|.85[}f,メアリーさんは靴を買います。,"Mary bought shoes,",メアリーさんはくつをかいます。,,"Japanese::Sentences, lesson-4"
ijvoE~cm|{,メアリーさんはかばんも買いました。,Mary bought a bag too.,メアリーさんはかばんもかいました。,,"Japanese::Sentences, lesson-4"
yFmuyh81!*,私は先週京都に行きました。,I went to Kyoto last week.,わたしはせんしゅうきょうとにいきました。,,"Japanese::Sentences, lesson-4"
j}2+5p?AxN,大阪にも行きました。,"I went to Osaka, too.",おおさかにもいきました。,,"Japanese::Sentences, lesson-4"
wJC2g89<?C,ロバートさんは土曜日にパーテイーに来ました。,Robert came to the party on Saturday.,ロバートさんはどようびにパーテイーにきました。,,"Japanese::Sentences, lesson-4"
N<vdB:Q<)4,日曜日にもパーテイーに行きました。,"He went to a party on Sunday, too.",にちようびにもパーテイーにいきました。,,"Japanese::Sentences, lesson-4"
lWg3k(`<?H,メアリーさんはそこで武さんを一時間待ちました。,Mary waited for Takeshi there for an hour.,メアリーさんはそこでたけさんを一じかんまちました。,,"Japanese::Sentences, lesson-4"
oxYWn?3?^w,私は昨日日本語を三時間ぐらい勉強しました。,I studied Japanese for about three hourse yesterday.,わたしはきのうにほんごを三じかんぐらいべんきょうしました。,,"Japanese::Sentences, lesson-4"
bgJ{0i|iHo,昨日七時間半寝ました。,(I) slept for seven and a half hours last night.,きのう七じかんはんねました。,,"Japanese::Sentences, lesson-4"
d*gnfFnrTr,私は京都で写真をたくさん撮りました。,I took many pictures in Kyoto.,わたしはきょうとでしゃしんをたくさんとりました。,,"Japanese::Sentences, lesson-4"
t-AbI.T#lq,果物をたくさん食べました。,I ate a lot of fruits.,くだものをたくさんたべました。,,"Japanese::Sentences, lesson-4"
nWb?#qtFhW,日本語と英語を話します。,I speak Japanese and English.,にほんごとえいごをはなします。,,"Japanese::Sentences, lesson-4"
KAjo;?u2PX,京都と大阪に行きました。,I went to Kyoto and Osaka.,きょうととおおさかにいきました。,,"Japanese::Sentences, lesson-5"
QIOs/r<7`6,昨日面白い映画を見ました。,I saw an interesting movie yesterday.,きのうおもしろいえいがをみました。,,"Japanese::Sentences, lesson-5"
Nay=QES&He,山下先生は怖い先生です。,Professor Yamashita is a scary teacher.,やましたせんせいはこわいせんせいです。,,"Japanese::Sentences, lesson-5"
"jy;,wz/pg;",京都できれいな写真を撮りました。,I took a beautiful picture in Kyoto.,きょうとできれいなしゃしんをとりました。,,"Japanese::Sentences, lesson-5"
"QD@~n]k,$D",山下先生は元気な先生です。,Professor Yamashita is an energetic teacher.,やましたせんせいは 元気[げんき]なせんせいです。,,"Japanese::Sentences, lesson-5"
mGYpxJou[q,沖縄の海はとてもきれいでした。,The sea was very beautiful in Okinawa.,おきなわのうみはとてもきれいでした。,,"Japanese::Sentences, lesson-5"
k*6ZZ]A(IZ,この部屋はちょっと暑いです。,This room is a little hot.,このへやはちょっとあついです。,,"Japanese::Sentences, lesson-5"
BHB{Ut#5Dc,ロバートさんは日本語のクラスが好きです。,Robert likes his Japanese classes.,ロバートさんはにほんごのクラスがすきです。,,"Japanese::Sentences, lesson-5"
uo5^uVP)=s,山下先生は魚がきれいです。,Professor Yamashita dislikes fish.,やましたせんせいはさかながきれいです。,,"Japanese::Sentences, lesson-5"
mKR5)Lg-lk,私は野菜は好きですが、肉はきれいです。,"I like vegetables, but I don't like meat.",わたしはやさいはすきですが、にくはきれいです。,,"Japanese::Sentences, lesson-5"
k1H+8<&/8/,たけしさんはメアリーさんのことが好きです。,Takeshi is in love with Mary.,たけしさんはメアリーさんのことがすきです。,In the expression of romantic or familial affection the complex particle のことが can replace が。,"Japanese::Sentences, lesson-5"
t$s!Y$b>@Z,たけしさんはコーヒーが大好きです。,Takeshi likes coffee a lot.,たけしさんはコーヒーがだいすきです。,,"Japanese::Sentences, lesson-5"
ut8g1_{b.H,キムさんは納豆が大きれいです。,Ms Kim hates natto (Japanese fermented soybean delicacy).,キムさんはなっとうがだいきれいです。,,"Japanese::Sentences, lesson-5"
EcBegU)do%,好きでも嫌いでもないです。,I neither like nor dislike (it).,すきでもきらいでもないです。,,"Japanese::Sentences, lesson-5"
3~$D7<1/d,これは私の好きな本です。,This is my favourite book.,これはわたしのすきなほんです。,,"Japanese::Sentences, lesson-5"
"Id,TVFVn&S",一緒に図書館で勉強しましょう。,Let's study in the library together.,いっしょにとしょかんでべんきょうしましょう。,,"Japanese::Sentences, lesson-5"
L}yCcz0yg:,喫茶店でコーヒーを飲みましょうか。,Shall we drink coffee at a coffee shop?,きっさてんでコーヒーをのみましょうか。,,"Japanese::Sentences, lesson-5"
Ns2l;NR6Q~,リーさんは切手を三枚買いました。,Lee bought three stamps.,リーさんはきってを三まいかいました。,,"Japanese::Sentences, lesson-5"
"%,KA.8%Z#",教科書を読んでください。,Please read the textbook.,きょうかしょをよんでください。,,"Japanese::Sentences, lesson-6"
gi~LD@D}*V,すみません。ちょっと教えてください。,Excuse me. Please teach me a little.,すみません。ちょっとおしえてください。,,"Japanese::Sentences, lesson-6"
i-5}MXfZ@v,窓を開けて。,"Open the window, will you?",まどを開あけて。,"If you are talking to a very close friend or a member of your family, a te-form, by itself, can be used as a request.","Japanese::Sentences, lesson-6"
KQ>7S$g?%e,教科書を見てもいいですか。,May I see the textbook?,きょうかしょをみてもいいですか。,"In casual speech, you can drop も and say 食べていいです。","Japanese::Sentences, lesson-6"
lTL;xp#Awx,ここで写真を撮ってはいけません。,You must not take pictures here.,ここでしゃしんをとってはいけません。,"は cannot be dropped unlike, も in ～てもいいです。","Japanese::Sentences, lesson-6"
x9~)o[Y!~-,ノートを借りて、コピーします。,I will borrow her notebook and photocopy it.,ノートをかりて、コピーします。,,"Japanese::Sentences, lesson-6"
rkObxLkwqu,今日は、六次に起きて、勉強しました。,Today I got up at six and studied.,きょうは、じにおきて、べんきょうしました。,,"Japanese::Sentences, lesson-6"
ONnxD8<)Fk,食堂に行って、昼ご飯を食べましょう。,Let's go to the cafeteria and have lunch.,しょくどうにいって、ひるごはんをたべましょう。,,"Japanese::Sentences, lesson-6"
e(H{mtzt{*,バスに乗って、会社に行きます。,I go to work by bus.,バスにのって、かいしゃにいきます。,,"Japanese::Sentences, lesson-6"
i[PIk*Xk^A,教科書を忘れて、すみません。,I am sorry for not bringing in the textbook.,きょうかしょをわすれて、すみません。,,"Japanese::Sentences, lesson-6"
"h,r>C%`2c:",私は今晩勉強します。明日テストがありますから。,I will study this evening. (Because) we will have an exam tomorrow.,わたしはこんばんべんきょうします。あしたテストがありますから。,,"Japanese::Sentences, lesson-6"
ll/{EsFT[&,バスに乗りましょう。タクシーは高いですから。,Let's go by bus. (Because) taxis are expensive.,バスにのりましょう。タクシーはたかいですから。,,"Japanese::Sentences, lesson-6"
xNd}MZS?V4,（私が）やりましょうか。,I'll do it.,（わたしが）やりましょうか。,,"Japanese::Sentences, lesson-6"
G.=>!vA5B5,荷物を持ちましょうか。,Shall I carry your bag?,にもつをもちましょうか。,,"Japanese::Sentences, lesson-6"
keH>/PT$ZT,スーさんは今勉強しています。,Sue is studying right now.,スーさんはこんべんきょうしています。,,"Japanese::Sentences, lesson-7"
lm==pR`ESB,たけしさんは英語の本を読んでいます。,Takeshi is reading a book in English.,たけしさんはえいごのほんをよんでいます。,,"Japanese::Sentences, lesson-7"
mihJpT[v=o,私は英語を教えています。,I teach English. / I am teaching English (right now).,わたしはえいごをおしえています。,,"Japanese::Sentences, lesson-7"
fGbvk:FW}>,メアリーさんは毎日日本語を勉強しています。,Mary studies Japanese every day.,メアリーさんはまいにちにほんごをべんきょうしています。,,"Japanese::Sentences, lesson-7"
O.YV~kQ5%H,山下先生は結婚しています。,Professor Yamashita is married.,やましたせんせいはけっこんしています。,,"Japanese::Sentences, lesson-7"
ppG)G&/fYB,みちこさんは窓の近くに座っています。,Michiko is seated near the window.,みちこさんはまどのちかくにすわっています。,,"Japanese::Sentences, lesson-7"
n}rHprtFMe,スーさんはお金をたくさん持っています。,Sue has a lot of money.,スーさんはおかねをたくさんもっています。,,"Japanese::Sentences, lesson-7"
nM/3`oE}:o,山下先生は母を知っています。,Professor Yamashita knows my mother,やましたせんせいはははをしっています。,,"Japanese::Sentences, lesson-7"
d!g`&u(_?(,トムさんはちょっと太っています。,Tom is a little overweight.,トムさんはちょっとふとっています。,,"Japanese::Sentences, lesson-7"
Re.9WtVl@Y,私の弟はとても痩せています。,My younger brother is very thin.,わたしのおとうとはとてもやせています。,,"Japanese::Sentences, lesson-7"
F:KR5uFXyo,メアリーさんはTシャツを着ています。,Mary is wearing / wears a T-shirt.,メアリーさんは Tシャツをきています。,,"Japanese::Sentences, lesson-7"
N*1B47${wt,お父さんは起きています。,Dad is up and awake.,おとうさんはおきています。,,"Japanese::Sentences, lesson-7"
bNwDthg]UG,家族は東京に住んでいます。,My family lives in Tokyo.,かぞくはとうきょうにすんでいます。,,"Japanese::Sentences, lesson-7"
n^el:5@AU5,私の姉は日本の会社に勤めています。,My older sister works for a Japanese company.,わたしのあねはにっぽんのかいしゃにつとめています。,,"Japanese::Sentences, lesson-7"
ttu]j3g>3C,中国に行っています。,Somebody has gone to / is in China.,ちゅうごくにいっています。,Not: She is going to China.,"Japanese::Sentences, lesson-7"
zrZLkC`BTn,家に来ています。,Somebody has come over to visit.,いえにきています。,Not: Somebody is coming over.,"Japanese::Sentences, lesson-7"
OLN~Nn8(RG,トムさんは髪が長いです。,Tom has long hair.,トムさんはかみがながいです。,"(= As for Tom, he has long hair.)","Japanese::Sentences, lesson-7"
zDQTRHbOe-,あの店の食べ物は安くて、おいしいです。,The food at that restaurant is inexpensive and delicious.,あのみせのたべものはやすくて、おいしいです。,,"Japanese::Sentences, lesson-7"
q[q|wrxDDD,ホテルはきれいで、よかったです。,"The hotel was clean, and we were happy.",ホテルはきれいで、よかったです。,,"Japanese::Sentences, lesson-7"
