guid,expression,meaning,kana,notes,tags
cdiOnxA5X-,（私は）部屋を掃除するのが嫌いです。,I don't like cleaning my room.,（ わたしは）へやをそうじするのがきらいです。,,Japanese::Sentences
d)r32N>E{t,ロバートさんは料理を作るのが上手です。,Robert is good at cooking meals.,ロバートさんはりょうりをつくるのがじょうずです。,,Japanese::Sentences
cs*3iQ1wP+,たけしさんは英語を話すのが下手です。,Takeshi is not a good speaker of English.,たけしさんは えいごを はなすのがへたです。,,Japanese::Sentences
c/3h{t92@4,私は日本語を話すのがとくいです。,I am good at / comfortable with speaking Japanese.,わたしは にほんごを はなすのがとくいです。,"To describe one's skill or lack thereof, we often use ～がとくいです、～がにがてです。",Japanese::Sentences
P5cqBWV8yH,私は日本語を話すのがにがてです。,I am bad at / uncomfortable with speaking Japanese.,わたしは にほんごを はなすのがにがてです。,"To describe one's skill or lack thereof, we often use ～がとくいです、～がにがてです。",Japanese::Sentences
y^zp/&ILY?,ロバートさんが沖縄に行きました。,ROBERT went to Okinawa.,ロバートさんがおきなわにいきました。,Used when answering a question / introducing a topic.,Japanese::Sentences
UCu|&s?W.,誰が沖縄に行きましたか。,Who went to Okinawa?,だれがおきなわに いきましたか。,Not: 誰は沖縄に行きましたか。,Japanese::Sentences
K1qs&Wfq-4,どのクラスが面白いですか。,Which class is (the most) interesting?,どのクラスがおもしろいですか。,,Japanese::Sentences
xK1V@dH`Eg,日本語のクラスが面白いです。,Japanese class is (the most) interesting.,にほんごのクラスがおもしろいです。,,Japanese::Sentences
rr(bK/vk_U,（このクラス）誰がめがねをかけていますか。,Who wears glasses (in this class)?,（このクラス）だれがめがねをかけていますか。,,Japanese::Sentences
LnihdUPjh],山下先生がめがねをかけています。,Professor Yamashita wears classes.,やましたせんせいがめがねをかけています。,,Japanese::Sentences
O=%m|BAl43,猫が何か持って来ました。,The cat has brought something.,ねこが なにかもってきました。,,Japanese::Sentences
v#uSgVs.jB,猫は何か食べましたか。,Did the cat eat anything?,ねこは なにかたべましたか。,,Japanese::Sentences
B57);>h%q8,いいえ、猫は何も食べませんでした。,"No, the cat did not eat anything.",いいえ、 ねこは なにもたべませんでした。,,Japanese::Sentences
